"text","stars","votes_cool","votes_funny","votes_useful","sentances","totalSentBING","totalSentNRC","totalSentAFINN","totalSent","meanSent","varSent","negCount","posCount","neutCount"
"THANK YOU ROB! i truly appreciated all the help i received from this agent today who was able to removed the extra charges on my bill that the Pasadena Verizon Store on Lake was charging me on my bill for upgrading my phone.   When i went in i was having problems with my Blacberry and had to switch to the Iphone last week. Rob from the Pennsylvania store who i was connected today was able to look at my bill and all the notes and correct the problem immediately. Great Customer Service! He even set up a FOLLOW UP Phone Call with me On July 5th to make sure the credit goes through on my bill...I can't thank him enough!!!!",5,7,3,7,5,4,1,3,2.66666666666667,0.8,1.7,1,3,1
"After waiting for almost 30 minutes to trade in an old phone part of the buy back program, our customer service rep incorrectly processed the transaction. This led to us waiting another 30 minutes for him to correct it. Don't visit this store if you want pleasant or good service.",2,1,1,1,3,3,7,5,5,1,3,1,2,0
"I visited this store several months ago to simply ask about smartphone plans. The agent was pleasant and helpful. I would recommend a visit to this store.",4,0,0,0,3,3,7,6,5.33333333333333,1,1,0,2,1
"Slowest customer service in charlotte",2,0,0,0,1,-1,0,1,0,-1,NA,1,0,0
"I have been a VZW customer for many years.  As long as I can make a call anywhere, at any time, I am not hard to please.  I had to visit VZW because the sound was too low during phone calls.  VZW could not repair it and sent me to the Apple Store.  Apple could not repair it so they replaced my device.  Four hours later, I have a new phone, but I can't activate it because VZW is performing system maintenance that was supposed to be done three hours ago.  Come on VZW, I thought you were better than this!  Now I have my contact list but I can't call anyone!  Give me a break, please!  Four stars for the fast and friendly service received at this location.  Unfortunately, they were not able to repair or replace my phone.  Today, sadly only 3 *** for VZW overall!",4,0,0,0,12,-1,3,4,2,-0.0833333333333333,0.810606060606061,4,2,6
"I was looong overdue for a new phone but I was trying to hold out for the iPhone 5.  Unfortunately, my phone had other ideas and started bugging out and I knew I couldn't hold out any longer.  I had a late morning flight last Thursday and realized I had time to head to Verizon to solve my problem.

I was the 1st person in the store and was greeted immediately.  Justin was the sales person who assisted me and I think he did a great job.  I told him what I was looking for and he helped steer me towards the phone that would be suit my needs.  He also told me one of the phones I was looking for was out of stock and that helped me make my decision since I needed to leave the store with something new.

Once I made my decision he helped me get everything set-up and even charged the phone for me a bit since I told him I'd be travelling.  All in all it was a great experience and I would have no issue returning here for future purchases or help.",4,0,0,0,8,0,3,-1,0.666666666666667,0,2,2,4,2
"Just another cell phone store one day great service, one day no one cares, and then the last day its about getting you in and getting you out as quick as possible.",3,0,0,0,1,1,4,1,2,1,NA,0,1,0
"My aversion to Verizon Stores probably stem from my experiences years ago with no check-in system and the ""first come first serve/wait forever"" system.  So I am always cautiously optimistic whenever I go into one of them.  

The other day, my droid incredible stopped receiving phone calls.  I had been limping along, hoping to wait for either the iPhone5 or a new droid.  Anyways, I had a family emergency and could not be reached so I finally just broke down and got a new phone to avoid future stress in not being able to be contacted.

I got there around 10:45am and the store had maybe one or two customers in it.  I was up for an upgrade, but didn't harp about the phone not receiving any calls - figured it wasn't worth the trouble to explain and my phone was over 2 years old now.  

Justin really helped me out and having experienced both the iPhone and Android phones, he gave me a lot of good information since I was still on the fence.  I ended up going with the 4S.  I also got a zagg screen protector and an otter box commuter case which Justin applied to my phone.  He transferred all my contacts and also was able to trade in my incredible for some salvage money.  The trade in program must be new, but I did ask him what they did with the phones and after they wipe the memory, the phones are given to countries that cannot afford to buy directly from retailers.  It's good to know the phone will get a second life and not be wasted.

I was in and out of there in 45min and Justin was really knowledgeable, answering all of my questions and really providing great service.  

I'm still waiting for the iPhone 5 to come out (probably tomorrow) but so far I am very happy I made the ""switch.""",4,0,0,0,15,5,9,4,6,0.333333333333333,1.52380952380952,2,7,6
"Ehhh, your typical Verizon location.
I've been going to this location for years, not because it's fantastic or the staff goes above and beyond, but they're by my house and they get the job done ... albeit slowly.  The parking is good, the staff is efficient, they have the phones you'd expect and, well, what else can I say?

Check 'em out.",3,0,0,1,4,3,7,4,4.66666666666667,0.75,2.25,0,1,3
"Took 40mins (and i was next in line) for me to exchange my 2 chargers that I had 2 replace 4months ago.the guy that helped me was to busy checking out women to wait on me",2,0,0,0,2,1,0,0,0.333333333333333,0.5,0.5,0,1,1
"I won't waste your time talking about the great service I received at this Verizon Wireless location when I purchased my iPhone 5. What I will share with you is the phenomenal job Verizon Wireless does to support entrepreneurs and small business owners.

I wasn't very surprised when the manager came out to ask me about my experience opening my business account but I was truly amazed when he came to invite me to a free social media workshop for small business.

As a new member of the Charlotte community, the Verizon Wireless staff plugged me in to local organizations that support entrepreneurs. At the seminar, the manager actually gave me a few places to network and get connected with other business owners in Charlotte metro area.

What turned out to be just a trip to the store to buy a phone quickly turned into an opportunity to grow my business.",4,0,0,0,5,5,13,7,8.33333333333333,1,1,0,3,2
"Some of the worst customer service we've ever encountered. We've been ""next"" on the list for 45m. Understandable that it's a friday night, but of the 6 people on staff, 3 were flirting with people (no joke, I saw numbers exchanged, and not for Verizon purposes) and the other three were hiding in the back. As we left, I said to the manager, ""remove us from your list, we're leaving."" She says ""okay sorry,"" not apologetically, but reflexively. Verizon is going to lose customers for this. Do not go to this location.",1,0,1,0,7,-3,-4,-1,-2.66666666666667,-0.428571428571429,0.285714285714286,3,0,4
"Terrible ""hostess"" experience. Woman at the front had a terrible attitude as soon as I walked on. The store is basically empty and I've been waiting for 40mins when I was told my wait time would be 15mins.

Add On: 

This is my fourth time coming back due to inventory and no fault of the stores. I'm continued to be so disappointed by the ""hostess"". They really act like you're an inconvenience. Will probably be my last trip and just drive an hour and a half to go to my home store. Really disappointed. This is not the experience I'm accustomed to receiving from verizon.",1,0,0,1,9,-5,-12,-3,-6.66666666666667,-0.555555555555556,0.277777777777778,5,0,4
"Very unhelpful. The staff did not even attempt to address my needs.",1,0,0,2,2,-1,0,0,-0.333333333333333,-0.5,0.5,1,0,1
"The first time I came in, one of the staff on the floor helped address some of my questions when trying to pick out my new device. She was helpful and even offered to help me with discounts because I didn't need all of the accessories. She even helped me sort out some billing questions I had on my shared plan. For this reason, I am giving them an extra star. I wish I could remember this one's name.

I went back the next day and was served by Rebecca. She was unfriendly and never smiled! She helped me with what I needed, but seemed uninterested in helping me make my purchases. When it came time to check out, she barely gave me any information in regards to:

1. What kind of rebate I was getting and how to really go about doing it.
2. Did not ask if I wanted her to put on my screen protector, decided to do it herself, and didn't even make it straight
3. Asked me if I wanted insurance but never told me what it included
4. Did not ask me if I wanted all of the accessories but just assumed I wanted the bundle.

These are just a few of the concerns I had. I think that if I never asked questions, I would have not learned about any of these things. I was less than impressed with the customer service I received. It was so poor that I almost just walked out of the store without buying anything. She was lucky I already knew what I wanted.",2,0,0,1,16,4,17,13,11.3333333333333,0.25,0.733333333333333,3,6,7
"I was very disappointed at the service I got here.  My iphone is 1 1/2 years old and was turning off on me constantly.  I didn't drop it and never had problems before.  I went to the store for help and they checked the battery and then told me there is nothing they can do unless I purchase a warranty on the phone.  I went home and deleted old photos and videos and updated the software and it no longer shuts off.  I just think it's ridiculous they told me there was nothing they could do unless I bought a warranty, when clearly there were simple things I could do to fix it!!!",1,0,0,1,6,-2,-6,0,-2.66666666666667,-0.333333333333333,0.266666666666667,2,0,4
"Frankie is a GREAT salesperson: very knowledgable, fun to work with, and attentive!! Alex is the manager we worked with and he is also extremely knowledgeable (and a good salesperson too). We had a defective antennae on our long-awaited iPhone 6; it couldn't be authorized or connect to cellular service. Both Verizon and Apple tried hard to troubleshoot over the phone for HOURS, but it was the staff at the East Wash store in Madison that resolved the issue immediately. Frankie and Alex spent much time diagnosing the problem and then acting immediately when it became clear the antenna was defective: they ordered a replacement iPhone shipped overnight!! Phone issues are maddening, given the amount of cash we pay for our phones, and after weeks of waiting we were beyond-frustrated to get a defective phone from Apple. But the staff at this store took control and resolved the issue overnight: FIVE stars for a rare level of customer service!!",5,0,0,0,5,-1,5,5,3,-0.2,17.7,4,1,0
"I felt a little ill after our experience yesterday at the Verizon store. It could have been the questionable food at the Baja Fresh we ate afterward. But, no- it really was the see-sawing of our entire lengthy transaction. 

We were due for the ""new every 2"" deal, but, wouldn't you know it- the prices for the phones we wanted that Hubby had been quoted in an e-mail expired 2 days before! Then we needed to go back out on the floor to look for more affordable models. 

Bonus point for the salesman getting Hubby a gov't employee discount on the phone plan and accessories.

Bonus point for finally having a device in house that will transfer your contacts and photos for you. Minus a point for his lame joke about it costing $10. Minus a point for his inability to transfer my pics when he could transfer Hubby's. 

Minus 2 points for screwing up the rebate process by ringing up the same phone twice, so now the UPC codes on the box and the rebate form don't match. So much for reminding us so often about the glorious $50 rebate per phone, that finally made us choose to go with the original phones we had wanted in the first place. So now I have to squeeze in a trip back to the store sometime very soon before the whole deal expires, or possibly and tragically lose my- wait for it....wait for it.... f-ing ""Verizon Debit Card."" WTF? The sales rep never said anything about a debit card. Can I only conveniently use it at a Verizon store? Shockingly, the rebate printout does not say specifically.

I like my new phone well enough, and I have been a Verizon customer for many many years and have not ever had trouble with them. However, I don't think I'll shop anywhere but online again for my phone needs. The human factor made the shopping icky.",2,6,4,5,19,-1,-8,8,-0.333333333333333,-0.0526315789473684,1.16374269005848,6,6,7
"I'm seriously shocked that there are not more neg reviews on here about this place because I hear people bitching all the time. 

First of all, do not expect to make a quick 'in-and-out' experience. You walk in and put your name on the List.. yes, list with a capital L. What is interesting is they ask you what your question/comment/concern is but when you finally get called five hours later, they ask you to explain your question/comment/concern all over again.

Let's just say you have a Blackberry Pearl 8130 and the roller ball does not work anymore. Hypothetically, of course. So the highly skilled guy behind the counter looks at it for 2 seconds and says ""Oh, looks like it needs to be replaced..."" I'm pretty sure I already said that. ""Unfortunately, we don't have any of these in stock..""

Wha? Come again? You don't have any more of one of your most popular phones in stock, in any of the 542 colors it comes in? Boy oh Boy.

""Here, you can call this number and request they send you out a new one."" Great, the same number that told me I had to go into the store to get it replaced.

Oh brother what a bummer.",1,0,4,3,12,4,8,7,6.33333333333333,0.333333333333333,1.15151515151515,2,4,6
"I'm really surprised that the other reviewers had such a bad time in this store.   

My last carrier was Alltel, and Verizon gobbled them up this year.  Being a cell phone owner since the days when they came in a bag like a heavy small carry-on bag, I have to say I HAVE NEVER HAD A PLEASANT EXPERIENCE IN A CELL PHONE STORE BEFORE.   EVAH. 

I've had a Treo for many years.  Last year, I dropped the phone and broke the screen.   Went into the Alltel store and they literally said to me, ""sorry you're screwed; we don't replace screens; you have no insurance; you're still under contract"" - so my only solution was to buy a new one for $600 according to the very harried and unpleasant rotund pimply fellow at the Alltel store.   Methinks there must be another way!

So I got on line and found this PDAparts.com for replacement screens.   They warn you: this voids any warranty!!!   But it was ""only"" $70 so I went for it.  They actually have a step-by-step video posted on YouTube on how to replace the screen.  Scary, but my trusty friend/co-worker Chris is an engineer so he did the dirty work for me in about 5 minutes flat.  YAY.    Phone worked perfectly until.... one day... the screen just went blank.

So I'm hosed now right?  And it's December.   The phone technically still WORKED, as in: it rings, and I can fumble to answer it... but I can't see who's calling or who is texting me or make calls... or read my emails... so it was kinda limiting.

So with much trepidation I wandered myself over to the Verizon store on Camelback, figuring I was now only 1 month away from the end of my contract and maybe I just had to bite the bullet and switch to a new phone.    They don't make the Treo 755p anymore, and I really didn't want to learn how to use a whole new phone... too busy.  But I guess I gotta. 

So you walk in and they ask you:  do you need service or sales, and what's your name?    Service... Jane.     They put you on a list which is on a big monitor, and tell you: you are 4th in line for service.   Sigh... look around... and not 5 minutes later, I'm called up. 

The very friendly and CUTE guy who helped me took a look and agreed, the screen is fried.    Do you want to pick out a new phone today, or can you wait a few days to get a refurbished 755p?    Huh?  I could get another 755p?    Yes we will replace your phone but we don't have them HERE so you'd have to wait a few days.   Um... okay... I guess I can wait, but, how much will that cost?   ""Oh, it'll be free.""    FREE?    Sold! 

The people working there were joking around with each other, easy going and super helpful.  There were other people in the store who were clearly stressed and in a bad mood, and from what I observed these folks were super-great at defusing them. 

Something good is going on at that shop and based on my experience (a) I highly recommend them; and (b) I'm sticking with Verizon!",5,0,1,2,39,11,15,7,11,0.282051282051282,1.26045883940621,3,10,26
"First I want to say I love you Bob... I really do.

While hosting a party at the art gallery I got a bit handsy/button pushingsy (no those are not real words but they explain the situation) with my blackberry. I am not technology driven. I wasn't even alcohol driven I have no excuse whatsoever. However, I somehow managed to erase seven months of my child's life in one fell swoop or button push. I immediately wanted to fall into the fetal position and cry a river of tears (or at least a small pool or jacuzzi.) I, the non-stop talker, was speechless. As all the color drained from my face my friend asked what was wrong, and luckily she had her fourteen year old son with her (technology wizards) and he was able to convince me to live until I could get to the Verizon store to have them try to retrieve my photos. This all happened on a Friday night. I was so terrified that they would fail that it took me until Monday to work up the courage to go to the store. I had worked up an ulcer the size of a quarter, and when I went to the store on Camelback and 16th Street at first I was thinking... well I can't write what I was thinking but the store had moved.

The store was located between a mattress store and Baja Fresh. It was small, cramped, and always seemed stressful. I am happy to say it just jumped over to where a video store was located and is in the same general vicinity. Luckily my five year old was wearing her glasses and wanted juice so we spotted it. The new store, now next to Jamba Juice, has a new vibe. It is larger, spacious, and seems more friendly and relaxed. I was seen with very little delay. 

This is where the hero of the story comes in. Bob, Bob, Bob the name rolls off my tongue like a... well, I can't quite think of something that rolls off my tongue but Bob was the man who worked and worked on my phone and got all my pictures back. He saved my life, okay not my life, but the photos of my sweet girl and for that I am very grateful. So if you are in that area and have a Verizon phone you need to deal with, this is the store I would recommend. And be sure to tell Bob hello.",5,1,0,3,24,6,17,14,12.3333333333333,0.25,2.10869565217391,6,10,8
"My experience here was.....ok.  The guy at the counter was friendly enough (although not overly talkative).  I had called previously to inquire about upgrading my old blackberry to the new iphone 4.  They had them in stock, and the guy told me he'd set one aside and i could come in and pick it up after work.  I had originally planned to just order one online (I was due for an upgrade), but didn't want to wait for it to arrive by mail....instant gratification was key.  

So i went to the store, but had already researched what type of service and features I wanted to include.  I told the guy that I wanted to add Rhapsody, but asked him if he could explain how it worked first (for those that don't know, it's supposed to be a $10/month music download program - unlimited tunes).  He was quick to state ""oh, that's not available on the iphone""....confused, I asked why it was offered in the package online then.  He was adamant that it was not a feature available to the iphone, until I asked him to research it.....Whaddaya know. It WAS available.  He said nothing and we moved on.  Next, he asked if I wanted insurance.  I said no, but i wanted the extended warranty for $1.99/month.  He stated again ""that's not available with this phone"".  AGAIN, i asked why it was offered online.  He said it probably wouldn't have let me check out with it.....and then clicked a little button, and low and behold...it let him add the extended warranty.  I then informed him that I wanted to reduce my minutes from 900 to 450, since i have not gone over the 450 in over 6 months....He looked at my account and said that i should absolutely stay with the 900 minutes because I would definitely go over.  Mind you, I had just checked my account earlier in the day, so I knew where I stood.  He told me that I was already at 380 minutes, and I would have to pay extra for any minutes I went over.  I looked at him for a minute....then told him that since my cycle restarted tomorrow,...I was clearly still going to be ok.  He said nothing and kept going.  He then asked me if I wanted to look at cases and I said no because I had already found a specialty one online that I planned to order.  He stated that I should definitely look at their selection first, because they had a ton to choose from and could probably get me discount.  So I said ok and he walked me over to their turnstile....with a total of 8 choices (and three of them were variations of black).  When I asked what the discount was, he said he could get me a discount....if i bought a package that included about 5 other things that i didnt even need or want.....

Overall, he was nice and I got the phone and plan i wanted....but only because I had researched it myself.  Don't expect them to know what they're talking about, and go prepared!",3,3,4,4,25,10,6,14,10,0.4,0.416666666666667,0,8,17
"This location is the sole reason that after 13 years, we are no longer AirTouch/Verizon customers, and will never, ever be again. I went in to upgrade my phones one afternoon only to be accosted by an angry, pimply faced little elf of an employee. He was disrespectful, got in my face, and talked down to me the entire time when all I had wanted was two new phones. When I got sick of his attitude I demanded a manager and he said there wasn't one. As if. He then called security, which is when I REALLY got mad! I began yelling at the top of my lungs when ""magically"" a manager appeared out of the back room to investigate the commotion. The manager sent the kid on a ""walk"" and apologized profusely, saying they've had problems with him before. My question was: WHY THE HELL DOES HE STILL WORK THERE?!?! He asked what he could do to make us happy and I asked for the regional manager's phone number. He provided the regional manager's cellular number, which I promptly called. After explaining what had happened, both managers agreed to cancel our two accounts with no early cancellation fees. Woot.",1,1,1,2,13,-3,-13,-1,-5.66666666666667,-0.230769230769231,0.525641025641026,5,2,6
"This location of Verizon gave me the customer service experience equivalent  of a car wreck.",1,0,1,0,1,-1,-2,0,-1,-1,NA,1,0,0
"If I were rating them on their great cell service, I would give them 5 Stars!! I have been with them over 10 years now and I will never change because I ""Don't"" get dropped calls like all the other cell services I have had or my friends & family has.

Now on their customer service I give them 1 Star Only!!!  I always have a BAD experience with their employees, Every time!!",4,4,6,6,4,1,2,-1,0.666666666666667,0.25,0.916666666666667,1,2,1
"i wish i had got his name, but they have an employee in there, white guy, shaved head, he was trying to be kinda smart with me and act like he was above me, kinda like he was competing, now i wore my tank top in there, i am 26 but i look like im 20 and im not trying to act tough, i never do. Anyway i tried to be nice at first, and when explaining my problems (there are about 5 different problems i am having with my brand new stratosphere 2) he would tell me ""well there's nothing we can do about that"", and im like ""well what about all these other problems"" he would reply ""what other problems"" 2 TIMES after ive explained all my problems he says""what other problems"" i said f*** it dude you are an idiot im going to talk to someone else... so i talk to someone else here are the problems im having with the stratosphere 2 in my first two days (mind you i haven't really used my phone these two days because these problems are constant and f***ing annoying):
1. i cant send or receive calls/texts (this happens on and off)
2. if my text is somewhat long people either dont get it or they get a couple words out of the few sentences, just a couple f***ing words sometimes half of a word
3. the calls that do go through, well 75% of the time no one can hear me, i can hear them, they cannot hear me
4.the phone reads my sd card but it wont play my music (the sd card works fine in my stratosphere 1)
5. i cant use my apps, they randomly just exit and im back to the front screen, if i try again it happens again

OF COURSE when i go in to show them the phone starts acting normal, so i cant get a replacement on this f***ing phone that i cant even use, have to keep re trying my calls, miss texts, people dont get my texts or they get a couple words from it AND i cant use my apps, so pretty much nothing on this f***ing phone works, but i cant get a new one.....",1,0,0,0,2,4,2,2,2.66666666666667,2,2,0,2,0
