"text","stars","votes_cool","votes_funny","votes_useful","sentances","totalSentBING","totalSentNRC","totalSentAFINN","totalSent","meanSent","varSent","negCount","posCount","neutCount"
"I had a very bad experience at this store. I was initially helped by an associate named Tanner who told me that the iPhone 4 would be upgraded with SIRI come the new year, which was and is not the case. Furthermore, he told me that the new family plan that I received was only going to cost $10 more when in actuality it ended up costing $30 more. When I answered a survey in a negative manner, the store manager gave me a call and ensured that he would follow up with me when my first bill came out. However, in true fashion, I never received any call or follow up from him. Overall, I am very disheartened by, not only the lack of service but also the blatant lies to make a sale. When will businesses learn that the value of a customer is not based on a single sale but rather their long term buying potential. I am planning on switching over to a new carrier when this contract expires. I would recommend that folks avoid this particular Verizon store altogether.",1,0,0,1,9,-2,-6,4,-1.33333333333333,-0.222222222222222,1.94444444444444,3,2,4
"Buying a cell phone has become a more painful experience with each passing day. If it's not the obscene fees the carriers are pulling out of their rectums, it's the aggressive and sometimes deceitful service you get at the retail stores.

This particular store was a little bi-polar.  When I purchased a new phone in December of last year it was a pleasant and low pressure interaction. I asked the rep a couple of questions (to confirm what I had already researched) which he answered correctly along with adding some info I was not aware of. Overall, it was one of the best retail experiences I've had in a long time.

Fast forward to April 8th and it was as if I had entered an entirely different store. From the first greeting you could sense the desperation in the air of ""I need to sell you something NOW."" I asked the rep a couple of questions about the phone I was interested in (which had also already been researched) and instead of getting the correct answer or even an ""I'm not sure, let me check,"" I got pure BS. It was a lame attempt to cover his ignorance while trying to pass himself off as a cell phone expert. There's nothing that pisses me off more than being lied to.  If you hadn't already guessed it, I did not purchase another phone from this store. 

The quality in purchasing experiences shouldn't vary this wildly between reps and they sure as hell shouldn't be lying to the customer either. This was the straw that broke the camel's back for me. I'm buying my next phone online and only using this store as a demo unit showroom.",2,0,0,0,15,-7,-10,2,-5,-0.466666666666667,1.98095238095238,7,5,3
"I desperately needed a new phone and these guys were great. I got there right when they opened and Daniel was very helpful. He answered any and all questions I had no matter how stupid he probably thought they were. Once everything was said and done I walked outta there with a new phone and realized it was the wrong color. Daniel promptly corrected the mistake and I love my new phone!

Thanks Daniel and Verizon.",4,0,0,0,6,1,1,-1,0.333333333333333,0.166666666666667,1.36666666666667,2,2,2
"Michelle in sales hung up on me rather than answer my question or redirect me about a phone exchange. Wow.
Verizon is normally better than this.",1,0,0,0,3,1,6,2,3,0.333333333333333,1.33333333333333,1,2,0
"this store is NOT A VERIZON STORE.  they do not state that anywhere.  They fraudulently issued me an insurance policy that has been charging my account for 10.99 a month.  I never signed up NOR agreed to this insurance policy.

BEWARE.",1,0,0,0,5,-1,1,1,0.333333333333333,-0.2,0.2,1,0,4
"I'm shock at all the negative reviews. This is my favorite Verizon store because the service is super fast. Also, no one here will try to sell you anything so everything is always quick and easy! I hate going to the other Verizon locations because it either takes too long to get service or they are trying to sell you a million and one thing! 

The customer service reps here has also been very helpful when I have questions. 

I guess go here if you know what you want! :)",5,0,0,0,6,2,1,1,1.33333333333333,0.333333333333333,3.06666666666667,2,3,1
"I tried buying one of the cheap Verizon Wireless kits, but after a lot of time and a lot of frustration I ended up just giving up and coming here. I should've just come here first!! My phone was back to new in no time at all!",4,0,0,0,3,-2,-3,0,-1.66666666666667,-0.666666666666667,1.33333333333333,1,0,2
"Bryant and his staff here are amazing! So thoughtful and helpful. Definitely come here :)",5,0,0,0,3,3,8,2,4.33333333333333,1,1,0,2,1
"I was in desperate need of a new phone and a new carrier, so I stopped in on my way to the grocery store.  I am so happy that I did. I now have a phone that works and I got awesome customer service.  Daniella was very nice and extremely helpful with getting my contacts transferred from my old crappy phone. She went above and beyond and even got my rebate paperwork ready for me to mail! It was just a pleasant experience overall. I would definitely recommend this store!",5,0,0,0,7,6,13,7,8.66666666666667,0.857142857142857,0.80952380952381,1,6,0
"This verizon store is amazing. Mitchell and Barrett were so nice and very informative!  They were quick, knowledgable, and kind. This was probably my first good experience with Verizon ! Thank you very much. It is my go to store now!",5,0,0,0,6,4,14,4,7.33333333333333,0.666666666666667,0.266666666666667,0,4,2
"Great customer service",5,0,0,1,1,1,3,1,1.66666666666667,1,NA,0,1,0
"Great customer service! Ask for Juan.",5,1,0,1,2,1,3,1,1.66666666666667,0.5,0.5,0,1,1
"Oh what fresh hell is this? It's Verizon and good luck trying to get ANYTHING done at this store. The wait is actually longer than the DMV. Associates are nice, but seriously, there are no words for how long this wait is. I was number 2, have been for awhile, then I was number 3 for a bit, now back at number 2. End of contract can't come fast enough. Ugh.",2,0,0,1,6,4,5,-1,2.66666666666667,0.666666666666667,1.46666666666667,1,3,2
"Logan was exceptional in customer service! He tailored everything to our specific needs. He mentioned ways we could save money on our plan. He went out of his way to make sure we got exactly what we came in for. Best wireless experience ever. I will continue to do all Verizon business with him at this location.",5,0,0,0,6,2,5,5,4,0.333333333333333,0.266666666666667,0,2,4
"I have to rave about Cesar a Verizon I think I spelled his name right. In Avondale Arizona. He was so courteous and nice I felt like I was in another world because you don't get that kind of respect anymore and I truly appreciated all his help because not everybody knows about phones and what they do especially is older folks like me. So I'm going back into Verizon Friday to buy a Bose system because he was so cool I really like that guy I told everybody about him if you want a good decent guy go to that guy no pressure just a regular nice young man.",5,0,0,0,4,11,21,6,12.6666666666667,2.75,6.91666666666667,0,3,1
"This verizon location is horrible. The customer service is a NEGATIVE 5 stars. The employees are rude and only see dollar signs rather than assist their customers and provide a great cellular solution. You are better off signing up with another cellular provider or going to another location. I HIGHLY RECOMMEND people NOT to come here",1,0,0,1,5,0,3,3,2,0,1,2,2,1
"Nice gentleman greeted me at the door. Got exactly what I needed which were two iPhone 5 at $199 each.  Fast service",5,1,0,1,3,2,4,1,2.33333333333333,0.666666666666667,0.333333333333333,0,2,1
"Maybe it is because I am so used to my home-store in California, but the two times I was at this location it was so slow. Genuine greetings, but service is sluggish. The first time around, they let people who came in after me get served first. I waited for over thirty minutes to get service. The girl who did help me was quick and efficient. The second time I was there, it was another 10 minute wait, when they were slow and they had 2 available reps. Makes me love my Rengstorff store in MV.",2,0,0,0,7,1,5,3,3,0.142857142857143,0.476190476190476,1,2,4
"The only thing I have to compare Verizon to is one of the major electronic stores that offers cellular phone service. Sadly, Verizon employees didn't seem as knowledgeable and weren't as customer service savy as the electronics store. The last time I did an ""upgrade"" to my cellular account and got a new phone, I went to the electronics store and got better service, from a friendlier, more knowledgeable employee. That's not to say this trip to Verizon was bad, but you would think the Verizon store would be the best place for all things Verizon. The electronic store actually had more variety to choose from when it came to upgrade options.  I don't like the fact that you cannot just come in and browse without having an employee come up with their notebook and ask for your name, account number, etc. It's almost like going to a car lot. Regardless of the price you get on an ""upgrade"", there is a thirty-dollar upgrade fee. Seems a little misleading for a free or ninety-nine cent upgrade. It looked like there had been a lot of employee turnover since my last visit to this location. My previous visits were much better, in that I dealt with employees who really knew their stuff and the customer service seemed better. We were ""assigned"" a customer service rep after signing in, but she went on to help somebody else, because we didn't know exactly what we wanted. Last time they asked about our phone habits, useage, etc. to determine which phones were best for us. This time seemed more like a cattle call and them making a sale, rather than servicing the customer. The rep we dealt with tried to upsale me a case that I didn't need, as the phone I got is billed as ""more durable"" and comes with a built in case. I don't think any other cellular provider is going to be much different, so making a switch doesn't seem too feasible. I did like that I was able to add the fees, taxes, etc. to the monthly bill and didn't have to come out of pocket for anything. I will probably go back to the big electronics store, though, for any future Verizon service, upgrades, etc.",3,1,1,2,18,12,16,7,11.6666666666667,0.666666666666667,0.352941176470588,0,11,7
"Great customer service! Now I know we all know the feeling of starks coming at you for a sale, or in this case starting you a new contract/phone. Not here! The guy who helped me (Chad) was awesome, really the whole staff was. Upon entering you are immediately greeted by a associate then put on the list until the next available representative can help you. 

Here's what won me over though.. I wanted to start a new contract/phone, the 9 yards. Got my phone packed and everything. Unfortunately I lost my ID and without it, couldn't process the whole thing. Going home disappointed I didn't get a new phone.. That same night, I found my ID! Came back the next day, while I was waiting to be helped.. Another customer had forgotten his .. It seemed like the assciate was going to process the transaction anyways, which would have me me rely upset since I was turned away! But no, he didn't process the transaction. Good to know this is a solid well working team and everyone is on the same page!

Got my ID, got my new 5s. Everything went smoothly. I never had such great amazing service before at a celular place! The downside is, it's always ridiculouslyyyy bust here and the next closest Verizon isn't really that close.",5,0,0,0,17,7,17,2,8.66666666666667,0.411764705882353,1.75735294117647,3,8,6
"I waited here for 1.5 hours. 6 people on staff only 2 staff members working with costumers. Inventory low. Next time I'll drive the extra 10 miles for a better service. Yikes please don't waste your time!",1,0,0,1,5,0,2,1,1,0,0.5,1,1,3
"I don't normally go out of my way to write a bad review, but for the situation I came across I believe it merits one to WARN future customers who come to this location for customer service.

I came on a Saturday with an intent to buy a new phone in which the agent, Saul, assisted us with. Now, we were difficult customers to begin with because we could not completely understand the breakdown of charges they were going to give us based on various options. Saul was very nice and was very patient with us. But of course some things may be too good to be true as we all know that all agents here not only are required to provide good customer service as top priority but they also get commission. So agents will have their own agenda in mind.

Now we were given a good option to take the Edge program where we make monthly payments towards paying off a new phone. However, Saul pitched to us (of course in a very nice and charismatic way) that with the program we would pay an up front price of $140 towards some sort of ""insurance to keep the phone in good condition"" when we would have to trade it back one day. So we bought into this BS with our undivided trust on Saul to be very honest. With this ""insurance"" up front cost came ""a series of retail products that come for FREE!"" we were ecstatic! We were thinking we were getting a good value here!

I went through my receipt when I got home realizing that I was charged $140 on retail products I didn't even want! Phone car charger, screen protector, phone case, and a $60 blue tooth device. WOW! So..that's what my insurance was. I was upset and felt completely taken advantage of as no one explained to us this ""deal"" or option. I'm not quite sure if this is a Verizon sales tactic that this company trains them on or its purely developed by these agents but this is absolutely NOT COOL.

I came back to speak to the manager nicely about our predicament in which he was willing to refund everything, but no apology, and instead decided to correct me ""it's a bundle option that goes with the Edge program."" Yes, FOOL I KNOW IT'S AN OPTION NOW! However, NO ONE DECIDED TO TELL ME THAT WHEN I GOT IT THE FIRST TIME. They pitched to me AS IF IT WAS NECESSARY. Being two women who came off as incompetent because we could not understand his breakdown, I felt completely taken advantaged of. So I am livid and would NEVER GO BACK.

So, be prepared to come in with your guard up on this one...and DON'T TAKE the ""bs bundle"" unless you really really want it.",1,0,1,1,23,9,17,20,15.3333333333333,0.391304347826087,1.97628458498024,6,10,7
"I normally never do reviews but today my experience here was terrible! One of the employes was very rude to me and even told me I was to dumb to go online and do something on my own I needed to call customer service! She kept repeating the same thing to me and even was rolling her eyes. She never answered any of my questions. My husband was speechless at how this lady was treating me! Needless to say I will NEVER go back here!",1,0,0,0,6,-4,-6,-1,-3.66666666666667,-0.666666666666667,0.666666666666667,3,0,3
"waited over an hour to return few item...this is a little annoying 


~bah humbug!..",1,1,0,1,1,-1,-2,-2,-1.66666666666667,-1,NA,1,0,0
"I ventured over to the Verizon Wireless store on Sunday afternoon because I was eligible for the ""new every two"" deal that Verizon runs. I wanted to upgrade my phone and ask some questions about plans for smartphones because the Verizon wireless website wasn't very clear.

The store is very clean and laid out well with so many different phones on display that you can try out. There is an area to ""check-in"" when you enter the store. I didn't check in since when I got to the store, I was the only customer there; later when the store got busy, the check-in kiosk becomes important as it puts you in queue to be helped by a salesperson, customer service rep, or technician.

I was helped by Katie (I think that was her name) and she answered all of my and my husband's questions. She explained the plans very well and made it much easier to understand than how it was presented on the Verizon website. She was so polite and helpful and even set up my email on the Blackberry Curve so I wouldn't have to figure it out.

This is probably the best Verizon store I have been in, and I have been to 5 different stores in 3 states. By far this had the nicest layout, the most organized system to help customers, and the shortest wait time to process a transaction from sale to set up of device of any of the 4 previous Verizon stores I had visited.",4,0,0,2,10,12,12,14,12.6666666666667,1.2,0.622222222222222,0,8,2
"I went to Verizon at Tempe Marketplace on a weekday after I got off work because my phone was making a random beeping noise every 15 minutes that was unrelated to my battery, so I wanted someone in technical services to take a look at it and show me how to make it stop. Once I entered the store, I signed in using their kiosk and waited patiently for over 30 minutes.

After my name was called, I went to ask the lady to look at my phone, only to discover that they DO NOT have anyone in technical services at that store, ever, which means that there is no one to help when customers are having issues with their current phone. The next closest store to me is at 16th St. and Camelback Rd., which from now on I'm going to exclusively.

The only thing they could do was switch out my phone for a new one, however, they didn't have any in stock, so I would have had to go to another store anyways. Talk about a pointless trip during rush hour.

Bottom Line: Try another Verizon store, not this one!",1,1,1,5,7,-1,0,2,0.333333333333333,-0.142857142857143,0.476190476190476,2,1,4
"I have to say I'm overwhelmingly surprised myself by the fact that 2 out of my 3 interactions with this location over the past 2 weeks have gone phenomenally well!  After  a bit of a rocky start (this really should've only been 2 visits in the last 2 weeks), today I had an AMAZING experience in-store with La'Tasha Royal.  

Today, I was finally able to transfer off of my old corporate account, establish my own billing, activate my new Droid AND La'Tasha and crew also helped me transfer my contacts, apply my new screen skin...etc.  Everyone was super friendly and helpful.  La'Tasha knew her stuff and helped me with poise, grace and a friendly can-do attitude that is often rare from service providers (think about your last dealings with the phone company, cable company or dishwasher repair).  Today was a breeze.

Thank you La'Tasha and everyone else who hooked me up today and made this a simple, easy and actually enjoyable interaction!",4,0,0,0,7,13,17,5,11.6666666666667,1.85714285714286,2.14285714285714,0,6,1
"Awesome store.  Very helpful.  Friendly.  Nate is the greatest!",5,0,0,0,4,4,11,3,6,1,0,0,4,0
"I went in there with a problem with my Iphone 4 and went in to see what they could do for me. The tech that was there, specifically named Angelo, was extremely unhelpful, he took one look at my phone and basically laughed. Then proceeded to tell me there was nothing that he could do for me. I asked him why and he said because it was accidental damage and I told him I had insurance and he said it did not matter. He didn't bother to look up my account info, he didn't bother trying to find some sort of solution other than paying 600$ in full for a new phone. The only helpful one there was the guy that greets you at the door. Failed to get his name, which I should have. Then to top it all off I call to complain and they don't bother to answer their phones. Convenient. 
Not pleased. At all.",1,0,0,2,11,-4,-4,0,-2.66666666666667,-0.363636363636364,1.05454545454545,6,3,2
"I went in yesterday in a bind because I had put my wifi SIM card in my phone and completely messed things up. I was in a hurry as I work in medical sales and had some patients trailing my equipment and I was asked to be avab....Kathleen and another gentleman were SO friendly and patient. Kathleen had my phone working very quickly. Thanks your help! You are awesome!",5,0,0,0,5,3,8,6,5.66666666666667,0.6,2.3,1,2,2
"I came here with my girlfriend to get 2 new phones. We were helped Promptly by a first person. He said, let me get someone who can help you better,that  knows more about what you want.     We were given a fabulous girl who helped us both with all of our needs. We got 2 new phones and everything switched over and out the door in less than 30 min.  We were very happy and on our way home in no time. Why the 4 stars, when i got home i found my contacts were not put on the new phone. I am sure it was a simple mistake but, now i have to waste time going back. But, i am still happy.",4,1,1,1,9,5,11,1,5.66666666666667,0.555555555555556,1.52777777777778,1,5,3
"I came here the other day with my boyfriend to get new phones. We are on differant accounts of course,so the guy helping us said let me get someone who can better help you. He did and we got a lovely girl that totally knew exactly what she was doing.  We were helped very quickly and got in and out of there in 30 min(that was for 2 of us).I thought that was great! Love my new phone and love Verizons customer service.",5,2,2,2,5,6,15,3,8,1.2,0.7,0,4,1
"I have been with Verizon for over 10 years and I almost always get great customer service but NEVER from this location.  I go out of my way to avoid this store if I can.  
Best Buy had a deal on the phone I wanted but they were having trouble transfering my phone number when they were redoing my contract.  I went across the street to Verizon and they told me there was nothing they could do...no suggestions...nothing.  Their only suggestion was that I purchase the phone through them which was $90 more and she said they couldn't match their price.  I asked her if I went to T-mobile & signed a new contract with them if I could keep my same number.  She said, ""I believe so.""  My response...""Merry Christmas"" and I walked out.  I went back to Best Buy and they were able to get Verizon on the phone and get it all worked out but seriously?  ZERO customer service at this place.",1,0,0,1,10,4,8,4,5.33333333333333,0.4,0.488888888888889,0,3,7
"I am writing to let you know about my experience at the tempe marketplace Verizon wireless store on Rio Salado Drive in Tempe, AZ. I had walked in with my fiance to get a new battery for my phone. We were greeted promptly and helped by a associate named Charlie. He went into the back to get the battery i had requested when he came out with the battery he (as well as pretty much the entire store) noticed a Giant dust storm moving in. He showed me the battery then walked past me to the window. I said that I wanted to purchase the battery and he (apparently excited about the impending storm) ran around in a circle towards the back.  I called out id like to get home before the storm to which he replied ""good luck"" and went into the back to get his phone. He returns and goes outside to take pictures, brushing past us again telling us to ""hang on"". At this point we left without ever purchasing the battery.",1,0,2,2,9,5,13,-1,5.66666666666667,0.555555555555556,1.52777777777778,1,3,5
"This place is so shady. I was there for three hours, worked with management, and spent over $400.  I was told that I had to switch my plan during my upgrade from unlimited data to limited.  While this is true, the manager told me that I use 5-6 gig/month, so I went with the plan he suggested.  Later after speaking with customer service on the phone, she told me that I have never gone over 2 gig and adjusted my plan accordingly.  The sleazeball at the store further disclosed multiple hidden fees at the register, rather than being honest from the beginning.   

I am seriously questioning leaving Verizon after 12 years due to this experience.",1,0,0,4,7,1,2,2,1.66666666666667,0.142857142857143,0.476190476190476,1,2,4
"Always busy.  Usually a 10-15 min wait.  Service is good.  The last time I went the guy told me I could get this one credit transferred over  to my old plan which I wasn't able to do.  Fortunately, it was only a 10 dollar rebate, but still.  Could have been 10 extra dollars.",3,0,0,0,6,2,3,3,2.66666666666667,0.333333333333333,0.266666666666667,0,2,4
"I'm not always a happy camper when I walk into the Verizon store, but I must say the last few times I have walked out a happy customer. Dare I say their customer service may have improved? I don't like pushy sales situations so when salesmen start trying to upsell and drop a bunch of lines, I get turned off. I know their job is sales, but I usually just try to do my own thing looking around until I'm ready for help. 

I'm very pleased with the iPhone warranty replacement I just received. It looks like a brand new phone. I felt like that process was really easy and I really didn't have to go out of my way or be inconvenienced. In the past, it took awhile to get the new phone and I don't remember the transition being as simple. (I remember losing contacts, photos and being without a phone for a few days on one occasion.) So this time around, life was gravy baby. 

Main gripe= too expensive. But you get what you pay for and I rather pay more to have a reliable phone service and quality equipment.",4,1,0,1,12,6,11,12,9.66666666666667,0.5,1.18181818181818,2,8,2
