"business_id","categories","city","date","entropy","industry","name","negative","negativity","positive","positivity","review_id","stars","state","text","Topic 1","Topic 2","Topic 3","type","user_id","votes_cool","votes_funny","votes_useful","wordsLength"
"rrV9jCOG18cB7FtOOZpubA","Banks & Credit Unions,Financial Services","Las Vegas","2013-04-11",0.439660728622064,"Banking","Wells Fargo Bank",4,0.0512820512820513,13,0.166666666666667,"0hxBkWbOMA9zf-Agox_gNQ",4,"NV","Convenient location (closest intersection: Jones and Spring Mountain). 1 ATM in the front, possibly 2 in the drive thru area in the back (never used before).

The one time I had to go in to deposit a check and pull out extra cash for rent, the line was not too long and moved quickly (think it was a Wednesday around noon) . Staff was pleasant to interact with, just the way they were trained to do by corporate or the branch manager.

Plenty of parking spaces whenever I am here.  So I would say this is a good branch for customers that mainly utilizes ATM to conduct their WF transactions, with the occasional in-branch visit.

Getting out of the parking lot to head North on Jones can be a pain, if you are there during peak traffic hours.  In which case try to use the center turning lane, and Frogger your way over as needed. Just be careful of north-bound vehicles that want to turn left onto Spring Mountain Rd.  Don't want no real life Game Over head on collision or hassles with insurance companies and Five-Os.

4 stars.

Be safe!  Peace in the South China Sea.",0.113773641595736,0.140738547660607,0.745487810743658,"review","XHkzCzmIAB3DnjQO7v6jww",0,0,1,78
"rrV9jCOG18cB7FtOOZpubA","Banks & Credit Unions,Financial Services","Las Vegas","2013-09-27",0.307319502297941,"Banking","Wells Fargo Bank",0,0,0,0,"91aNl3BBWe3Ya-cLUJ7_Kw",3,"NV","I needed to stop at an ATM last night and this location was on my way.  There's not a whole lot I can say about the experience except it was quick.  There was  no one there and I drove right up to the machine and was on my way quickly.

The only thing that threw me was the fact that their ATM is opposite almost every other Wells Fargo.  Instead of being on the outside lane, the ATM is the one against the wall as you drive in.  Strange.",0.0753966517433894,0.0955966471435897,0.829006701113021,"review","Iu3Jo9ROp2IWC9FwtWOaUQ",2,1,1,22
"rrV9jCOG18cB7FtOOZpubA","Banks & Credit Unions,Financial Services","Las Vegas","2013-12-09",0.436121574216104,"Banking","Wells Fargo Bank",9,0.101123595505618,10,0.112359550561798,"x0RemaYXRH5_b7VZykxneQ",1,"NV","This review is long overdue, but just can't forget the bad experience I had here!

I had $200 in cash. What I wanted was $100 to go toward my credit card and to exchange the other $100 bill for $20s. Sounds simple enough, right? Apparently not! The teller (wish I remembered her name) took the first $100 bill, processed the payment and printed out the receipt. Then, another employee comes up to her and asks if she saw a cashier's check ""lying around somewhere."" She looks around her area and tells him no. Then she takes my other $100 bill, puts it in her drawer and asks ""is there anything else I can help you with?""
Me: ""Ummm, I'm waiting for my $20 bills for the other $100 bill I gave you....""
Her: ""Didn't you only give me a $100?""
Me: ""No, I gave you two $100 bills.""
Her: ""Did you really?""

So she calls her manager over and tells her what happened. Then she said ""I got distracted because ______ interrupted me and asked me a question."" The manager tells her to count her drawer. Just great. So I have to stand there waiting for another 10 minutes because she didn't do her job. BS I tell you! When she was done, she laughed and said ""Oh, you were right."" Duh!! Seriously, WTF?!?! If you can't multi-task and/or pay attention to what you customers are giving you, maybe you SHOULD NOT be a teller?!?!

I did complain to Wells Fargo over the phone about the incident, but who knows if that even did anything. Ugh....never again!",0.358581120359003,0.557255222376531,0.0841636572644659,"review","_lmMNw0STDLEI1_qEro6Mg",1,2,3,89
"s2rNb_9479tdNp8qn027LQ","Banks & Credit Unions,Financial Services","Phoenix","2011-03-14",0.330535642303322,"Banking","Chase Bank",0,0,3,0.12,"ho51tv5G2n-DVnTJ8boA_g",5,"AZ","I dont' like to go to banks.

I prefer direct deposit and getting cash when I checkout at the grocery or at Circle K or the like.

I've had to go inside this location a couple times.  

Both times, I was approached by an employee who asked what I needed to do, who then sat me at a ""banker's desk"", where they took care of my transactions, without standing in line.

Nice!",0.301876400171373,0.218115283809128,0.480008316019499,"review","ngD5RF07pxwlq4euexSluA",0,0,2,25
"s2rNb_9479tdNp8qn027LQ","Banks & Credit Unions,Financial Services","Phoenix","2012-07-31",0.282955145545901,"Banking","Chase Bank",1,0.0666666666666667,4,0.266666666666667,"7A5wJZq6AesCmbtK-WKhNg",5,"AZ","I love this bank! Great ATM, never any problems. And whenever I have to go inside, the customer service is outstanding. When I started a new direct deposit Melissa from this branch called me to see how my new job was going! Wow!",0.166893716150734,0.568211911732249,0.264894372117017,"review","Jwlk7kWgFc6siNP_9KmhvA",0,0,1,15
"S4HV6A8DrN0XPR2pOhVtWA","Banks & Credit Unions,Financial Services","Phoenix","2012-02-07",0.382603292544529,"Banking","Wells Fargo Bank",0,0,8,0.163265306122449,"JFA2kjAyVsSyG2RIjhXWiA",4,"AZ","Dear wells fargo on Central,

I consider this bank my home bank. I tend to gravitate here most, between all of the Wells Fargo spread across the valley, its my favorite. 
Sometimes there is a water bottle cooler, like that and most of all on Friday they have fresh cookies, why? I guess to keep customers like me happy. You can go to the normal personal line, merchant teller, or drive thru.  I always like going into the wells Fargo, the people  are very nice and that makes me feel good about giving the bank money.  
Thanks for keeping a speedy line when I'm in a rush and allowing me to deposit my checks minutes before you close.

Happy banking,
Kevin",0.470442972607303,0.466794647298084,0.0627623800946134,"review","0qIsBt4EzBDCKrIviV55Ew",2,4,3,49
"S4HV6A8DrN0XPR2pOhVtWA","Banks & Credit Unions,Financial Services","Phoenix","2013-08-17",0.53497279920471,"Banking","Wells Fargo Bank",10,0.0332225913621262,35,0.116279069767442,"h37lvL9Xq99XBUvmbDqqgw",1,"AZ","My letter to Wells Fargo:

Wells Fargo
Attn: Branch Manager
3002 N Central Ave
Phoenix, AZ, 85012

To Whom it May Concern,

I understand the customer is NOT always right. I understand that I am not now, nor will I ever be your best, most profitable customer. I don't make a lot of money, I am living paycheck to paycheck and barely making ends meet. I am trying to get back on my feet to where I can live without floating one bill to pay another. I have a Second Chance account and I am trying to do the best so I can transition to a regular account. But none of this means your employees have the right to treat me like a second class citizen. You have to understand that in customer service, when a customer has a good experience, they tell one to two people. When the customer has a great experience they tell 3 to 4 people. On the opposite end of the spectrum. When a customer has a bad experience, they tell 10 to 12 people and when they have a horrible experience, they take to social media where they are visible to hundreds or even thousands of people. 
I am a relatively new customer to Wells Fargo. Since opening my accounts, I have been in several times for various transactions, usually depositing a paycheck (which are now direct deposited), and have really always received world-class service from your employees from the moment I would walk in, to the moment I left.
Yesterday was a completely different story. I will start by apologizing, as I was out of line at the end of the transaction. I drove off and flipped the teller off. I strongly feel though, that my actions at the END of this transaction do NOT validate your employees' treatment of me at the BEGINNING of the transaction. I was in a great mood because I finally received my tuition assistance check for $3669.00 from Arizona State University where I am a student. I rushed over to make it to your branch before they closed. I went through the drive through, only wanting to deposit this check. My friend and I waited for 10 minutes. The teller never apologized for the wait or explained what the hold up was, she just left us waiting. I am still in a great mood at this point though. Finally she comes back and advises simply that my check is being held. I ask why and until what date. This is when the conversation goes downhill. She tells me it is on hold until Tuesday because I have a Second Chance Bank Account and the check is from Bank of America and if I don't like that, I can go next door to Bank of America. 
Are you kidding me? Her first reaction is to tell me to take my business elsewhere?? Who does that?? She was so condescending and rude I was shocked. But I let it go and collected my ID, debit card and receipt. I noticed the receipt read the deposit was $3669 and that $3469 was being held. I pressed the call button and asked the teller about the $200 difference. She was clearly irritated with me at that point and tells me the entire amount is on hold as it clearly states on my receipt. I tell her its not clear on my receipt, that's why I am asking. She responds by telling me she is going to get her manager. What? Are you serious? Up to now, I have not talked back to her, I have not raised my voice, I have been completely respectful. The manager comes over. I try asking my questions again and she cuts me off saying as it clearly states on your receipt sir, the entire amount is being held. I say again, its not clear on my receipt. She again cuts me off and tells me its clear on my receipt. She cut me off and repeated herself 3 times. I was so furious I drove off and that is when I flipped her off. Again my apologies, but again, this does not validate how I was treated. I went into the branch as soon as they opened this morning and spoke with a manager. As soon as I told her I had gone through the drive through last night, she stopped me and said oh, ""you're the guy that flipped off my employees?"" and proceeds to lecture me as though I am a child and basically threatened to kick me out of the branch. Again, I had not raised my voice this entire time. She finally lets me explain what happened, and though she is verbally apologetic, it is clear she could absolutely care less. In fact, several times, she kept saying I don't know why they would have talked to you like that, I don't know what the circumstances were. There were no circumstances that I should have EVER been treated like that. Yes I flipped them off, but that was at the very end of the transaction as I was driving away. The manager never asked for my name or phone number, never said she would get back to me if she has other questions. She was just giving me lip service, and barely made any real effort at that.
Normally I can forgive and forget, but these two interactions from three employees are unforgivable and I am now questioning my loyalty as a customer.
What reason do I have to stay?

Sincerely,

Lucas R.",0.0584005876662097,0.881037217614091,0.0605621947196993,"review","esomNneHvsEv91MmraM5ug",1,2,2,301
"Si--IykCu1RtiW-_Jq5ZcA","Banks & Credit Unions,Financial Services,Mortgage Brokers,Home Services,Real Estate","Las Vegas","2010-12-02",0.357718558383996,"Banking","Bank of America",1,0.027027027027027,8,0.216216216216216,"qYpVON1l60Kk7qM-Y5x4Fg",5,"NV","I really liked this branch.  The personnel I dealt with, from the teller, banker, to the manager are all so nice, helpful, and best of all knowledgeable.  This is the nicest banking center I have encountered by far.  

The only thing I don't like is the busy location.  Traffic-wise...geez how I hate driving on Maryland PKWY.  Nonetheless, this banking center is big, many PBs on duty, excellent customer service (for me at least).  

I will go back as it is convenient and of course, having knowledgeable PBs and management personnel is the best when it comes to one's finance.",0.0600736997200309,0.737827912652293,0.202098387627676,"review","xV1hf20ZFDSoaMZmwLoHNg",0,0,1,37
"Si--IykCu1RtiW-_Jq5ZcA","Banks & Credit Unions,Financial Services,Mortgage Brokers,Home Services,Real Estate","Las Vegas","2013-08-14",0.360155769860189,"Banking","Bank of America",1,0.027027027027027,3,0.0810810810810811,"nkvWb2mxRmAhRK9f-_hF1w",5,"NV","I needed to deposit a third party check into my account and cash it right away. I don't do this often, but my boyfriend uses Compass and there is not one Compass bank  in Vegas. So, I went in with his check and asked for them to cash it. Without any problems, they took it and gave me the entire amount in cash (based on my relationship with BOA). I don't use this location since I live in Texas so I thought there would be some sort of hold/fee/issue, but none of the above applied. 

Great service. Also, there was no lines so it was a very fast transaction.",0.0811335387285445,0.614282691042828,0.304583770228627,"review","WTo5QmqJxbxImbusrcWlww",0,0,1,37
"Sm7JQfTm0cUrhNx_oVwa3Q","Banks & Credit Unions,Financial Services","Las Vegas","2013-11-15",0.237379973757342,"Banking","Wells Fargo Bank",1,0.0909090909090909,1,0.0909090909090909,"dfl906KY0dls_QEP5zmhWA",5,"NV","Easy deposit and friendly staffs. See Rauh Garcia if you need any help, he is a nice guy and will help you with any problem.",0.138099318111506,0.359770356288675,0.502130325599818,"review","jyz1rCf4apY154mWopv61Q",1,1,1,11
"SN0fYS9Mozu5qkPAq7K8ZQ","Banks & Credit Unions,Financial Services,Mortgage Brokers,Home Services,Real Estate","Phoenix","2013-06-04",0.37892260582538,"Banking","Bank of America",6,0.122448979591837,7,0.142857142857143,"dZc6dd24uJIfwWlDJ8pgdw",1,"AZ","My comment is directed at Bank of America in general. I had been banking with them for 15 years, with substantial lines of credit. Of course when times are good, they are your best friend. 
But when times are tough, they dump you like a bad case of the flu!

I know noone will care about this review! We all know the banks in general dont give a hoot about their clients. But at least I will feel better.

Of course, that was years ago, and now I am getting back to maklng money - and now I have banks knocking at the door.

But I will always remember the treatment they gave - cutting credit lines, closing accounts and suspending credit. All the while while the feds bail them out!

So screw you Bank of America!",0.591452741982777,0.050232591219777,0.358314666797446,"review","-WDIKh0cXhKCiUPJ9Tudjg",1,1,1,49
"TarYtm10MRmZvqCHc_BI4w","Banks & Credit Unions,Financial Services","Las Vegas","2010-12-05",0.382634457612989,"Banking","Wells Fargo Bank",2,0.0425531914893617,3,0.0638297872340425,"BmeYpcuM0iC1gw3xFaOSpA",4,"NV","This is my Sunday bank.  I go for a bike ride and get to the 2/3 spot at this plaza along Charleston Boulevard and Desert Foothills Drive.  When I need to make a quick deposit or withdrawal, this is the branch to which I go.  It was opened during the building boom, but many of the houses didn't follow, so this is often a slow place.

It's easy to get to, there are several other businesses here that makes the whole area a one stop place.

I have found the tellers to be quite competent when I've had to go inside.  But, since this is my Sunday bank, I usually just ride my bike up to the ATM outside, make my withdrawal, and make a fast pedal away with my loot.  Actually, I normally go right next door to the Starbucks in Albertson's.  Like I said,ma one stop place!",0.0451409751599563,0.055099352129476,0.899759672710568,"review","Iu3Jo9ROp2IWC9FwtWOaUQ",0,0,1,47
"TarYtm10MRmZvqCHc_BI4w","Banks & Credit Unions,Financial Services","Las Vegas","2013-12-25",0.362123200818514,"Banking","Wells Fargo Bank",2,0.0625,4,0.125,"ppmRrxYzIxRgIsULuq3Znw",4,"NV","Great location, as it's tucked away between Charleston and Desert Foothills.  Great for the West Summerlin crowd.   Staff is very friendly.

I'll have to say that the only complaint that I have against this place, and thus the one star from perfect is that the lighting at night is not the best.   Always had to be wary what was on all sides of the vehicle due to not having the usual type of flood lights in a drive-thru ATM situation.   The branch off of Canyon Pointe is lit much better, as a comparison.",0.174017895663276,0.0890357588256461,0.736946345511078,"review","P4HgVeyXQEtt62qUiYo_jw",0,0,1,32
"Tluc8HDsXRGAshD_ePmvzQ","Banks & Credit Unions,Financial Services","Glendale","2013-02-08",0.348170950369227,"Banking","Chase Bank",3,0.107142857142857,5,0.178571428571429,"KqfQ-d7vCJBp43iNeRbQiA",5,"AZ","This has to be the NICEST group of people I've ever dealt with at Chase. Mind you, this location is inside a Fry's grocery store, but they still provide all the services a normal Chase has... without the wait, long lines and ditzy tellers filing their nails. 

I always come here no matter what. It's convenient because it's in the area, and I love that I can get groceries/bath products all in one trip. If you're in this neighborhood, check this branch out.",0.0773202954153552,0.520629002477231,0.402050702107413,"review","3FRzcb41y7LYr5yRMQSoqw",3,3,3,28
"tw2JFF2ajHsSIBijRQ_3YA","Banks & Credit Unions,Financial Services","North Las Vegas","2011-03-30",0.350513571462965,"Banking","Chase Bank",2,0.0606060606060606,4,0.121212121212121,"N_cBBdkrFfsymhS0usrE8g",2,"NV","Just your average Chase bank with your average Chase employees. I come here because it's close to my house, but in comparison to otter branches, this one falls below the average star rating because there isn't much to their customer service. Don't expect an life changing experience, but I've never had any problems here. It really is strictly business for me here. I don't even remember one person's name at this branch and I always ask whoever helped me for their name for review purposes.

Not a big deal going on here but I always come back.",0.362003330649784,0.589262840393099,0.0487338289571176,"review","NVzfe0X8IAJMISy0Id4kKg",0,1,1,33
"tw2JFF2ajHsSIBijRQ_3YA","Banks & Credit Unions,Financial Services","North Las Vegas","2012-03-14",0.403632314594679,"Banking","Chase Bank",11,0.144736842105263,6,0.0789473684210526,"hpM68R_K35oPvDoic3C07A",1,"NV","This branch is aweful. How can you advertise something and not follow through with it? I used to get charged some retarded monthly fee and come here and they reimburse me the fee and say they fixed the problem.. then the next month, i get charged the same fee, then the following month: same problem and so forth. This went on for about 5 months or so. The last time i went there, the manager was rude and refused to reimburse me the fee and said that it was my fault i got charged those fees and that It was wrong for them to reimburse me the fees in the first place and ""shame on them for reimbursing you cuz they weren't supposed to..."" (let me also state that SHE was that one that reimbursed my fees a few times). Well honey, if you would have fixed the problem 5 months ago, I wouldn't have to waste my precious time and gas to come here every month for the same ridiculous issue that shouldn't have existed in the first place. I left pissed off, and I wanted to call Chase's 1800 number and file a complaint, but decided to go to another branch thats on Craig rd... and guess what! They fixed it right then and there and never had an issue since. They also politely reimbursed me and repeatedly apologized for the way i was treated at this branch. I go to the one on Craig rd now, they seem to appreciate people and know what good customer service is.",0.644071154892195,0.278203332997639,0.0777255121101665,"review","rXXbSOG1yx9s-c-YpJz4YQ",0,0,2,76
"tw2JFF2ajHsSIBijRQ_3YA","Banks & Credit Unions,Financial Services","North Las Vegas","2012-11-14",0.342308526536705,"Banking","Chase Bank",1,0.03125,5,0.15625,"NS0vDVpuzPdi_tS-17Ft6Q",4,"NV","I always liked this Chase but I like it even more now. They have added drive up banking and a ATM to the outside. You can still go inside and use one of the 2 ATMs inside but if you don't want to get out of your car they pull on around! The ATM is 24/7 and the teller is available during normal business hours.

The bank is clean inside and the tellers have always been friendly towards me. It is conveniently located in the corner of a  shopping center so stopping at the bank and running errands is a snap.",0.0411760669102404,0.0637885960626779,0.895035337027082,"review","2HmHgW3hRYvXYFmQyQtLuw",3,1,3,32
"uhHagdjbh9HE1YBhVPNRRA","Banks & Credit Unions,Financial Services,Mortgage Brokers,Home Services,Real Estate","Mesa","2012-03-19",0.429745856842672,"Banking","Bank of America",6,0.0681818181818182,8,0.0909090909090909,"JnjHwrfUjE_7cG8qaVesLg",4,"AZ","I recently experience a mild case of identity theft. Not too bad - the companies involved stopped the charges or refunded the money that had already been taken. But I did cancel my debit card and visit my nearby branch. I entered with two out of state checking accounts, a recent large deposit, and a barely used checking account. The various tellers have been asking me for 8 years if I wanted to change to an Arizona account, but I was too lazy.

I was helped this afternoon by the senior personal banker, Monica L. She was incredible. Very personable, patient, and helpful. She explained everything, made recommendations, and helped me put my accounts in the best position to work for me. I came away with an Arizona checking account and a money market account. The two out of state accounts will be transitioned out once the fraud charges have been restored. 

She made a challenging situation more manageable and I came away with a better line of services than I entered with. I have been a BOA customer for 8 years, but rarely use their services other than online. After my experience today I will definitely be more open to other services and using a personal banker like Monica for guidance.",0.484798404434241,0.491208784062889,0.0239928115028702,"review","zCC6huLkNBEr3JUgQyxJbg",0,0,1,88
"UiRL2bkkiVmhi39rDfZ1hw","Banks & Credit Unions,Financial Services","Las Vegas","2014-01-07",0.405515736320162,"Banking","Chase Bank",4,0.0615384615384615,8,0.123076923076923,"iFVRlH9nyTMmI08BjBOinA",3,"NV","This isn't my favorite location. Why? The location itself is RIGHT by a bus stop so there are often a TON of people in the parking lot waiting for the bus. It often is hard to find parking.

Today's visit was fine and uneventful minus a crack-head looking chick hanging out begging for $$, but the last time I was there a scary looking guy noticed me and followed me to my car trying to sell me knock off perfumes. 

I personally like to deposit cash when I am at the bank, so the last thing I want to do when going to the bank is worry about getting robbed in the parking lot. I think this location could use a security guard to make patrons feel safer bringing cash. 

Why 3 stars?? Although I would prefer not to bank at this location, I find the staff very sweet and helpful. The line is never too long and the tellers are fast.",0.0479645438055257,0.0917664129346436,0.860269043259831,"review","5hBsVMJOc8sXMPt8S3NjmA",0,0,1,65
"UiRL2bkkiVmhi39rDfZ1hw","Banks & Credit Unions,Financial Services","Las Vegas","2014-07-03",0.326028872598492,"Banking","Chase Bank",1,0.0416666666666667,3,0.125,"BnNHdkHvwNSa_yObogOCHw",1,"NV","This bank has the slowest most incompetent staff, all I wanted was a money order this process took them about 30 minutes to execute. I would rather drive across town to a branch who can execute simple tasks efficiently and promptly. You would think since they are so busy they would hire more competent people! So frustrating!",0.497021480481677,0.206030694396965,0.296947825121358,"review","ppDrWM99hTD_k0mlOYm9ig",0,0,1,24
"UmFnmIoLCRe1ywY0bzpRrQ","Banks & Credit Unions,Financial Services","Phoenix","2007-03-27",0.402302818346142,"Banking","Bank of America",2,0.0392156862745098,5,0.0980392156862745,"YFazrUaArfaMkBPRIkdGxA",2,"AZ","So B of A was the first bank where I ever opened a checking account or had a debit card. Maybe it was the aggressive advertising aimed at students that didn't know any better that sucked me in, but it was a great deal for them.

I think their dream client is a jackass teenager who forgets to check his account balance before he writes rent checks and pays phone bills so that he'll dip a few dollars too far into his funds. That way they can tack on an extra 25 or thirty bucks the next time he pays a dollar and 88 cents for a slurpee at seven eleven, and so on and so forth. 

Yeah, that happened to me. I don't bank with them anymore.

Though, I should say, there is the occasional good hearted teller who may cut you some slack around the holidays. They represent the second star.",0.792637308684146,0.0912933772162692,0.116069314099584,"review","Ovpa3S8xD96dLE5eDxcxJg",0,0,2,51
