"business_id","categories","city","date","entropy","industry","name","negative","negativity","positive","positivity","review_id","stars","state","text","Topic 1","Topic 2","Topic 3","type","user_id","votes_cool","votes_funny","votes_useful","wordsLength"
"D0jOohupZftHUnCdNiB2YQ","Banks & Credit Unions,Financial Services","Chandler","2013-04-29",0.455614288972036,"Banking","Wells Fargo Bank",7,0.0707070707070707,9,0.0909090909090909,"8SoAr0aizZJXczVNwN6NaA",1,"AZ","OK; been busy for a week or so, but finally got around to trying to address my problem.  So I drive to the branch bank here and talk with one of those so-called personal bankers.  Now not to seem officious or something, but I am a platinum/preferred client.  So they give me this gal as a personal banker and I tell her my issue and the problems I have had with their customer service call center.  She tells me that she is not well versed with trust accounts and cannot help me -- again, an issue of poor training.  So she goes to get the branch manager.  Now this gal is obviously more experienced and knowledgeable and I tell her my saga again.  She says that whomever gave me those stories were wrong.  There are no restrictions on trust accounts preventing me for transferring funds from or to those kinds of accounts.  

So she shows me how to do it.  While she is showing me, I notice that she goes thru a series of internet maneuvers that differ slightly from what I have always used, but she says that sometimes you have to use a work around to get around the bugaboos with their computer systems -- WTF???  How the heck am I supposed to know that???

In any event, she solves my problem but I still do not feel comfortable with the way WFB has these ""issues"" with their computer systems that you need to understand the ""alternate methods"" to get done what you want done.

But at least I got my problem solved but I still think their customer service is sorely lacking when they have the public deal with poorly trained or non-experienced reps.",0.300663495146648,0.675882292713812,0.0234542121395404,"review","fUs5XxOR82Hfrnyl4wi2QQ",1,0,1,99
"d14ce-wTeY0HqM0yX-0pBA","Banks & Credit Unions,Financial Services","Las Vegas","2011-03-02",0.383655049288752,"Banking","Wells Fargo Bank",3,0.0666666666666667,5,0.111111111111111,"ajsXeOm4Jz99mgPaTugHww",2,"NV","We hit a little speed bump on our way to Vegas, where our rental had caught fire and we lost more than half of our things, which included my whole wallet with money, cards, etc. I came into this branch in hopes to get a temporary card to help me during our trip, we were staying there for about 3 days. After a disastrous trip, I explained to them what had happened, and all they could help me with is $100 dollars to last for 3 days?! I verified everything I could possibly can, but without any type of ID they still couldn't give me anything.. I had even talk to the manager and no go.. sad to say my trip this time wasn't so much fun.. thanks wells fargo for nothing.",0.764304275313964,0.178719159559351,0.0569765651266855,"review","-YS3-F75d2sKWh_Y70Ts3w",1,0,2,45
"d14ce-wTeY0HqM0yX-0pBA","Banks & Credit Unions,Financial Services","Las Vegas","2013-02-01",0.361816572647437,"Banking","Wells Fargo Bank",3,0.0638297872340425,7,0.148936170212766,"IQ8Y2VDSYk-K21s-jbQ_rA",3,"NV","This may be weird writing a review for a bank that I am not a member of but I frequent this location almost regularly due to work. 

Being that I am not a member, I have a few problems sometimes because you have to be a member of their bank to utilize their services but after they tell you that, they always help you. So I just prepare to hear their little speech and know that they will still help me.  

I almost want to give this location 4 stars because they always help me with whatever I need but because they give me a hassle in the beginning I can't.

I have used this location for their notary services and as long as you call ahead guarantee that you won't have a long wait and it is very fast. (and free - if you are a member. But I have been able to get around that on a few occasions.)

The bank manager here is outstanding too. He is always friendly and very helpful.",0.0684599107693561,0.799639028200602,0.131901061030042,"review","bRIk0mT3GU51Zsrn2UpKIg",1,0,2,47
"d14ce-wTeY0HqM0yX-0pBA","Banks & Credit Unions,Financial Services","Las Vegas","2013-11-13",0.338893197676135,"Banking","Wells Fargo Bank",0,0,1,0.0263157894736842,"yfo7PVizzkNnd4hazGL5kQ",1,"NV","Worst Wells Fargo branch ever. I am a very high value client and this is the LAST time I give this branch my business, even though I have to drive farther to another branch. The manager George takes his time as he processes anything that requires ""teller assistance"" and refuses to deposit my checks without sending them to collections because the originate in Canada. I've been depositing these checks at every other branch for the last three years without a hitch, but every time I go to George's branch I'm given a very hard time.",0.407444996992124,0.523346436064039,0.0692085669438368,"review","5MhZD_0wc1ALyX5xf_c4TA",0,0,1,38
"d14ce-wTeY0HqM0yX-0pBA","Banks & Credit Unions,Financial Services","Las Vegas","2013-11-21",0.403910556651267,"Banking","Wells Fargo Bank",3,0.0566037735849057,9,0.169811320754717,"QGugfOOG38PnnUXWUguBIQ",5,"NV","The entire staff are awesome! I think I know almost every single persons name that work there and vice versa.  

I'll admit a few years ago I had a fall out due to an issue with a manager at this location.  But I'm glad that a year after that I happen to come in for a business emergency and found out that she no longer works there... So now I'm glad to say that I am back as a loyal, happy customer.  

They recently remodeled the place- so it looks more organized and updated.  They have bilingual staff - Japanese and Spanish people that can help you out with anything :P. This location gets high traffic due to all the businesses in their close proximity.  But definitely their professionalism and friendliness overrides waiting in line for a few minutes !!",0.262834191613648,0.453509569203262,0.28365623918309,"review","JSGMrxmqktQhLLKTLwpVMg",1,0,1,53
"D1MVTkDrt3UrQ0EebZu4NA","Banks & Credit Unions,Financial Services","Gilbert","2012-02-03",0.357508754037446,"Banking","Wells Fargo Bank",4,0.114285714285714,7,0.2,"sYMbPTo1JFJDkpXxhg6Yvg",4,"AZ","For Gilbert Wells Fargo Banks... This is my 1st Choice because of the Customer Service & No pressure banking. Other banks are pushy about signing up for Credit Cards, Savings Accounts and who knows what else... But not this bank. 

Fast, Efficient, Friendly, Free bottle of Water (YEAH BABY!), Smiles from the Employees... You won't dread walking in to this bank unless your Broke & the bank won't give you a loan... But thats not their fault!",0.477670962180181,0.404116829236666,0.118212208583153,"review","HKqLjjFGj4Sqi2VX83d2Dg",1,1,1,35
"D2h1xsCeYPf4X3uER3hN1g","Banks & Credit Unions,Financial Services","Phoenix","2013-10-17",0.229580677575385,"Banking","Chase Bank",0,0,2,0.222222222222222,"SEESWF8n7_RdzU2e0LatkQ",5,"AZ","Always greeted very friendly when I walk in everyone eager to help me! Awesome managers always ready to accommodate me!",0.230017204127751,0.540157758955708,0.229825036916541,"review","QIA6kDAsNh32XhUgfQeIag",1,0,1,9
"dng6ywGbupOE82XjTdzRBA","Banks & Credit Unions,Financial Services","Phoenix","2008-08-19",0.355392907206147,"Banking","Chase Bank",6,0.153846153846154,4,0.102564102564103,"TtfIAjLVU-PBeoU-hHxHeg",5,"AZ","This is for the credit card department of Chase Bank.

Our ID has been compromised five times and each time Chase has caught it as it is happening. They call to make sure it is not we who are charging these item and close the account right then. We have never had to do anything beyond acknowledging their actions. 

One time in Paris France Gus dropped his wallet at a restaurant. When we went back they had the wallet but not the chase card. We called Chase, they stopped the card and sent another to a hotel in London for us the next day as we were traveling there in the morning. It was at the hotel when we arrived. 

I have nothing but good to say about Chase credit fraud department, they are on the ball.",0.887356228654139,0.056583328144737,0.0560604432011244,"review","GubdNFoDAsiwE6bWIr97cQ",3,2,3,39
"dng6ywGbupOE82XjTdzRBA","Banks & Credit Unions,Financial Services","Phoenix","2009-04-29",0.384278727371546,"Banking","Chase Bank",5,0.113636363636364,8,0.181818181818182,"TA4Y1UXXq4JvN2gUwgPGFg",2,"AZ","I switched to chase from BofA, I wasn't a customer for very long because they put a hold on all of my checks. I was younger just starting college and didn't make much money but still, they put holds on my checks. and back then my $200 checks meant life or death basically. It was soooooooooo frusturating so i closed my checking and savings account. 

I currently have a chase credit card and everything has been fine, no problems. but nothing great either.

**update** chase increased my CC apr to an insanely high amount for no reason. i asked to have it lowered based on my good standing and what not. they declined so i opened a CC w wells fargo w a MUCH lower apr.",0.580141353036689,0.367359046352261,0.0524996006110499,"review","hFtlFksrcLaWHGPNa6SmeA",0,0,4,44
"dng6ywGbupOE82XjTdzRBA","Banks & Credit Unions,Financial Services","Phoenix","2013-11-04",0.412869074266098,"Banking","Chase Bank",14,0.159090909090909,12,0.136363636363636,"I4Eusxzb0gmBWyXlYa-wFg",1,"AZ","If you love being lied to, then Chase is the way to go for your mortgage! I had a terrible experience getting a mortgage at Chase. I had to call multiple managers at Chase before anything was done. They reimbursed me about $1000 for all the headache and bad information they gave me. $1000 seems like a lot, but they should have given us at least $3,000 back for deceiving us. 


I used Chase as my mortgage lender, and it was one of the most frustrating experiences I've ever endured. Robert Page, my mortgage lender, said that we would close on October 16th. Then he pushed it back until October 18th. Then he pushed it back until October 21st citing some ridiculous reason. Of course, we couldn't close on the 21 because of another ridiculous reason, so Robert pushed it back until October 25th. You see the trend? Then, we were supposed to close on October 28th....which didn't happen either. If you can't close on a certain date, then don't make a promise. It's that easy! I would have been much happier if you told me from the beginning that we wouldn't be able to close until October 29th...in which case I could have chosen a different lender.The situation got so bad that I had to reach out to Robert's boss, David Campbell. He said he would ""take care of us"" which is also another broken promise. In an effort to rectify the situation, Chase promised to reimburse us for the rent we had to pay when we couldn't move in on October 16th. Of course, they reneged on that as well.

Take your business elsewhere!",0.0240283706753333,0.0752541094696923,0.900717519854974,"review","nBqU_AHXCayr3BQWzfyB5A",2,0,4,88
"dng6ywGbupOE82XjTdzRBA","Banks & Credit Unions,Financial Services","Phoenix","2014-03-13",0.318112008829514,"Banking","Chase Bank",0,0,3,0.142857142857143,"cbshIvY47Ch8Y4g30Fy-0Q",4,"AZ","I love their app and this particular branch's easy driveway right off of Central Ave!  I don't personally bank here but I have in the past and I used to go in monthly to pay my rent.  I appreciate their warm welcome, fast service and extensive services.",0.0899420662728297,0.663404914462453,0.246653019264718,"review","svP9WkoIMN3Wta7W9ZhawA",1,0,1,21
"DWkqbIM93bNRrpPFn_765g","Banks & Credit Unions,Financial Services","Las Vegas","2011-03-07",0.296636497527644,"Banking","Wells Fargo Bank",0,0,2,0.0909090909090909,"ZTyp8Xuo3yYzgN88vYkVSg",4,"NV","When I lived nearby, I would visit this location often.  Now, I rarely stop by this location, but happened to be in the area recently.  The tellers here are always friendly and the service is quick.....those are 2 of my biggest requirements for a bank (Fast & Friendly).

Return Factor - 50%....would be higher if I lived nearby.",0.103630538881113,0.337711951105285,0.558657510013602,"review","kGgAARL2UmvCcTRfiscjug",4,2,5,22
"DWkqbIM93bNRrpPFn_765g","Banks & Credit Unions,Financial Services","Las Vegas","2011-06-12",0.296033025460062,"Banking","Wells Fargo Bank",0,0,2,0.117647058823529,"b5MmBSbHhtVYBa54et9wGw",3,"NV","I went to the ATM this morning.  The place was quiet--Sundays are always good for that.

I don't go to this branch very often unless it's right where I'm going.  There are other Wells Fargo branches that have better parking and ingress and egress.

Since I was on my bike at the drive through, it was an easy in and out today.",0.0836240263295615,0.171388139726716,0.744987833943722,"review","Iu3Jo9ROp2IWC9FwtWOaUQ",0,0,1,17
"DWkqbIM93bNRrpPFn_765g","Banks & Credit Unions,Financial Services","Las Vegas","2013-05-02",0.351416573820541,"Banking","Wells Fargo Bank",0,0,5,0.147058823529412,"TedcVqj5eiOrpDXQRwk9zg",4,"NV","There were several customers waiting in line, but it moved relatively quickly as there were also many tellers available to assist us.  The one that assisted me with my transaction was super quick and friendly (she was done with 2 customers in the time that the nearby tellers were assisting just one, possibly with more transactions or complex ones).

Anyway, fast, friendly and accurate banking services are attributes I look for from my bank, and the staff here has done a great job.

4 stars!",0.0821234930513847,0.662817153884714,0.255059353063901,"review","XHkzCzmIAB3DnjQO7v6jww",2,1,3,34
"DWkqbIM93bNRrpPFn_765g","Banks & Credit Unions,Financial Services","Las Vegas","2013-07-25",0.270471387755226,"Banking","Wells Fargo Bank",0,0,1,0.0588235294117647,"I7FoyhKq8MtWOBBkvF3CSg",4,"NV","Wells Fargo is my bank but this location was not my usual bank I always go to as this was across town.  never go inside and do almost all my banking needs through the ATM.  This one had two drive through ATM along with 3 drive through if you needed to use the teller.",0.0803294509070678,0.171661320115503,0.748009228977429,"review","xsGLM2cMKqNDJfo3wJCV5w",0,0,1,17
"DWkqbIM93bNRrpPFn_765g","Banks & Credit Unions,Financial Services","Las Vegas","2014-05-15",0.438671243793005,"Banking","Wells Fargo Bank",8,0.0792079207920792,10,0.099009900990099,"sSEFGAkVvY3_x8aYcaGOZA",1,"NV","This review is for Wells Fargo Bank at 4075 S Fort Apache Rd. Las Vegas, NV 89147.   

I just got back form being screwed by this bank, seeing as I'm not a customer there, but simply went in to cash a check drawn on their bank.  After ten minutes of ID's, data entry by the teller, thumb printing, etc.  they were ready to cash the check and then they tell me there's a $7.50 fee to do that.  I said that's ridiculous, as the check is drawn on their bank, and the teller manager Ruth Martinez tells me that the fee is NOT a Wells Fargo fee, but a fee that goes to the company who issued the check. LIES! I asked her twice about that statement and she lied both times.  I then called the company that issued the check, and sure enough there is no ""fee"" that goes to them.  Ruth refused to speak to them to hear it from their own lips. I asked that they waive the $7.50 charge, which is totally in their power to do so.  She said no.  I then waited for the branch manager who basically said the same thing. 

Sooooo, for $7.50 they will get bad press (deservedly so), I will never bank with them or go in their branches again, and I'll relate this story to all who will listen.  On a final note, there is a great employee there named Andrew who was very helpful.  You'd think in the era of supposed ""customer service"" it wouldn't be worth receiving a scathing review for $7.50.

I've banked at Bank of America for 25 years, and any problems that have arisen have been handled right away.  I know others haven't had the same experience, but I think they are much better than most.
.",0.475725643107794,0.501435316430267,0.022839040461939,"review","WYXhYkIYRLXdluidbJNDbg",0,0,1,101
"e4CSh0SfKoqlIiFlAFD5Qw","Banks & Credit Unions,Financial Services","Las Vegas","2008-12-26",0.245718510368088,"Banking","Wells Fargo Bank",1,0.0769230769230769,1,0.0769230769230769,"ISoxkUySaEHZyq0VKqNgbg",3,"NV","Lines move quickly, they serve coffee & snacks, and they are always friendly. Drive thru ATM's also.-Really why is there braille on the drive-thru ATM?",0.102399606031588,0.102693095216568,0.794907298751845,"review","Mx-vxv_V-SQCe76w4RmUfA",8,6,9,13
"E6tTmCnF2ym0zmOvgwi7yQ","Banks & Credit Unions,Financial Services","Las Vegas","2013-02-10",0.168164806758209,"Banking","Wells Fargo Bank",0,0,1,0.2,"orJSXhGV3SUt5mUzdDMT0w",3,"NV","There is always a line, like your at an amusement park.  They have a lot of windows, but never enough tellers!",0.1416549709472,0.333249415213224,0.525095613839576,"review","1pL-KrRvHcypkMVLd0MNtQ",0,0,1,5
"E6tTmCnF2ym0zmOvgwi7yQ","Banks & Credit Unions,Financial Services","Las Vegas","2013-03-03",0.434503789094041,"Banking","Wells Fargo Bank",3,0.032967032967033,10,0.10989010989011,"IV8ESsuM4QcrQrQ8FlA0lg",3,"NV","Probably one of my least favorite Wells Fargo Banks that I have to unfortunately hit every once in awhile.  This Wells Fargo is located off Silverado and Bermuda.  This is also one of the busier ones inside since it's fairly close to Las Vegas Blvd and in a busy shopping center.  

My biggest issues with this location is;

1.  No drive thru ATM.  There's a drive thru, but it's for El Pollo Loco.  I've been fooled the first time I came out here and thought I was in a ATM drive thru to find it out that it's for El Pollo.  As a result, found myself ordering some chicken. 

2.  The lines during the day are crazy long and it seems they take forever at this location. I know exactly why the lines here are long and you can thank guys like my brother-in-law that will only take money out of his own bank to avoid additional chargers. I probably spend more money on gas than the $2 additional charge.  

I get my hair cuts at the Xpress Cuts located in the same parking lot. So, I really have no choice about hitting this Wells every once in awhile.  Not really sure why I'm even reviewing this Wells Fargo Bank, but I always feel obligated to write a review if I am the temporary Duke of the location.  That's right...who's house?",0.427660981876588,0.0484643362940707,0.523874681829341,"review","oOayyTrVO-PbVeXXsh_JEQ",7,7,7,91
"E6tTmCnF2ym0zmOvgwi7yQ","Banks & Credit Unions,Financial Services","Las Vegas","2013-10-12",0.366535159539025,"Banking","Wells Fargo Bank",1,0.0256410256410256,5,0.128205128205128,"txY4Axw8dacrJ-XfvQ5yHA",5,"NV","I am not usually a fan of banks in general, but this location could sway me back towards the dark side. No charge to cash a check drawn from their bank (other banks typically charge and give you attitude) 
Nicole was very friendly even while soft selling me on the advantages of switching to this bank. I regret that I forgot the name of the teller after I left. She was very sweet. If I ever decide to switch banks (which is always a possibility) this place is my first choice.

Also Saturday hours, open until 4pm.",0.38316524756674,0.323450986336629,0.29338376609663,"review","yMEO4fsNxLpuFsZI3vGjPQ",2,3,2,39
"eBlflykQuNG1TZohqytYnQ","Banks & Credit Unions,Financial Services","Las Vegas","2014-04-23",0.213486313094562,"Banking","Chase Bank",0,0,2,0.222222222222222,"MSgFegnjFbTnOq0fNeG1Kg",1,"NV","This bank does NOT accept cash deposits! What kind of a BANK doesn't allow you to deposit a 20 dollar bill!!!!",0.506871088104955,0.132909938320647,0.360218973574398,"review","yXFDmMHAlMcKkEl-MinFng",1,1,1,9
"ecMFTCZFuivBgulwKXgkqQ","Banks & Credit Unions,Financial Services","Henderson","2013-09-21",0.337824573202984,"Banking","Wells Fargo Bank",2,0.0714285714285714,5,0.178571428571429,"dBi3i85hO9YpJ1D6ViHZgg",2,"NV","If you are a merchant don't go to this bank. Their 'policy' is to take whoever walks in first. My question is, Why even have a merchant line at all if you are going to treat everyone the same? However, it is a convenience we as business accounts pay for many times over. It may not sound like a big problem but when you go to the bank every day for your job and people who walk in after you are getting seen before you it makes your head spin. And that happens because not all the tellers ask who was there first.",0.355643380458492,0.592369336686886,0.0519872828546214,"review","fBMaw4UM-J9BtZCIRfiA-A",0,0,1,28
"EeyMo9_axC3OEzgiIbPs7A","Banks & Credit Unions,Financial Services,Mortgage Brokers,Home Services,Real Estate","Phoenix","2013-01-21",0.371512292346406,"Banking","Bank of America",1,0.0232558139534884,9,0.209302325581395,"VTMS44_XwJb_uttLrJretw",4,"AZ","I have been with B of A for roughly 15 years! I have a credit card with them a savings and checking account. I love being able to quickly & easily pay all my bills online. I set them up and never have to worry about it again.

Their customer service it not that great! It's very hard to talk to a real person. Some area's the customer service is good (in house) but some area's of town, it's shotty...

This is an easy Bank which is what I like the most about them. They make life very easy for you when it comes to banking and paying wills, etc...

Free notory, free cashier's checks, free coffee sometimes, if they have it!",0.453619742429587,0.307649547584448,0.238730709985966,"review","2v3j2y5PLMs0rlAd-pxoEw",3,2,4,43
"EfQynnWvo_vXR0TJejeBTQ","Banks & Credit Unions,Financial Services","Chandler","2014-03-26",0.3477809404139,"Banking","Wells Fargo Bank",1,0.0303030303030303,1,0.0303030303030303,"eJJl8U-EQ_B90x9aPRQZFg",1,"AZ","Very unhelpful and rude. I sat down with Francisco Ramirez to go over details of my account. I didn't have a debit card so he asked for two forms of ID. I handed him two STATE issued IDs and he said that would not work (iv never heard of that) it was an Arizona ID and my state drivers license. I has to go to my car and get my business license. After that he was rushed and very short and rude and my problem wasn't resolved. He just told me to call the number on the back of my card for better luck. Never coming back to this branch again.",0.279372760432037,0.611634764812087,0.108992474755876,"review","n3j5V4tqOB3KioGl6qOBcA",2,1,2,33
"ejx-rekLkZ2RkNgSejf0pA","Banks & Credit Unions,Financial Services,Mortgage Brokers,Home Services,Real Estate","Phoenix","2010-10-08",0.379552558031555,"Banking","Bank of America",1,0.0212765957446809,7,0.148936170212766,"t2kolJ9iDiIPB7AgTvnWQw",1,"AZ","If I could give a 0 star, they'd own it.. I have nothing.. Not one positive to say about this bank. I wanted a local bank because most of my money is in USAA which used to be hard to make deposits to because they are based in San Antonio. BofA has fees upon fees.. Long lines at any lunch hour... Waits on phone , awful customer service.. Oh and the kicker.. I deposited a trust fund check.. From Vanguard!! They wouldn't let me have it for 10-14 days.. Despite that Vanguard had cleared the check with them.. I'm guaranteeing BofA made interest off of my $7k! Don't get me started on what they have done to our housing market.. Ahh.. Thank God I can bank with USAA..",0.745110848398718,0.137048221097312,0.11784093050397,"review","sALB8-F04S9VcZMF_GkGUA",0,2,3,47
"ejx-rekLkZ2RkNgSejf0pA","Banks & Credit Unions,Financial Services,Mortgage Brokers,Home Services,Real Estate","Phoenix","2011-07-31",0.334856529031107,"Banking","Bank of America",0,0,3,0.115384615384615,"X14FWkCoBihtr_RiD9JFrw",2,"AZ","It's not the people, but how the bank itself runs that pisses me off. The fees, the red tape, the general BS I seem to have problems with these buttheads. I have three (3) business accounts here and they tell me time 
-and-again that I need to open a personal account to cash my paycheck with them. I own my business, the check is from them BofA, it's made out to me. F***ers give me my money, it's mine NOT yours.",0.418299498706146,0.50976567379759,0.0719348274962638,"review","x3be6uxIqd9Dypu-o9KsKg",6,6,6,26
